date,id,section,category,source_name,published_date,event_date,location,actor,title,summary,source_url,source_image_url,image_caption,what_happened,background,watch_point,work_hint,importance
"2026-07-08","20260708-society-a01408e9","society","国内情勢","NHK 経済ニュース","2026-07-02","2026-07-02","日本・インド","日本政府、インド政府","日本とインドが蓄電池供給網の強化で協力 覚書に署名","日本とインド政府は電気自動車向け蓄電池のサプライチェーン強化で協力する覚書に署名し、日本企業のインド市場進出を支援する。","https://news.web.nhk/newsweb/na/na-k10015167491000","https://imgu.web.nhk/news/u/news/html/20260702/K10015167491_2607022144_0702220342_01_02.jpg","日本とインドの政府関係者が覚書に署名する様子","2026年7月2日、日本とインドはEV需要拡大を背景に蓄電池の供給網を強化するための協力覚書に署名した。これにより日本企業のインド参入を後押しする。","インドのEV市場拡大に伴い、安定的な蓄電池供給が不可欠となり、両国政府が戦略的に連携、サプライチェーン強靭化を推進している。","【要約】日印両政府が蓄電池供給網強化で協力覚書を交わした。 【論点】日本企業のインド市場進出促進とサプライチェーン強化。 【次に見る】協力具体策と投資、参入企業の動向。","【意味】【意味】成長市場インドにおける日本企業の競争力強化の足掛かり。 【影響】国内外の蓄電池関連サプライチェーン再編を促進。 【リスク】政策変動や技術進展の速さによる対応負荷。 【今後】連携深化と具体的事業展開の注視が必要。【影響】提案冒頭で「なぜ今この論点が重要か」を説明し、対象業界の優先課題を整理しやすくなる。【リスク】政策・国際情勢系のニュースは実行策に落とすまでに追加情報が必要で、企業別の影響度や対象業界を確認する必要がある。【今後】具体的な制度設計、参加企業、投資額、導入時期、関連企業の発表が出るかを追う。","4"
"2026-07-08","20260708-society-715a30fc","society","国内情勢","NHK 政治ニュース","2026-07-02","2026-07-02","日本","日本政府","政府 海外からの直接投資呼び込む政策パッケージを決定","日本政府は海外ベンチャーキャピタルの国内スタートアップ共同出資の規制緩和などを盛り込んだ政策パッケージを決定、投資促進を図る。","https://news.web.nhk/newsweb/na/na-k10015167191000","https://imgu.web.nhk/news/u/news/html/20260702/K10015167191_2607021503_0702160440_01_02.jpg","政府関係者が政策パッケージについて説明する様子","2026年7月2日、日本政府は海外からの直接投資を呼び込むため、規制緩和を含む政策パッケージを決定した。特にベンチャーキャピタルの国内スタートアップ出資支援が盛り込まれた。","日本のスタートアップ資金調達環境の強化やグローバル競争力向上を目的とし、海外資本の参入障壁を緩和する動きが進む。","【要約】海外投資促進を目指す日本政府の規制緩和策が決定。 【論点】スタートアップ支援強化とグローバル資本誘致。 【次に見る】規制変更の実務影響と企業の対応状況。","【意味】【意味】国内市場の活性化と国際競争力の向上を支援。 【影響】スタートアップや投資環境の国際標準化進展に寄与。 【リスク】規制緩和によるリスク管理の適正化課題。 【今後】施策効果と規制対応の動向を継続監視すべき。【影響】提案冒頭で「なぜ今この論点が重要か」を説明し、対象業界の優先課題を整理しやすくなる。【リスク】政策・国際情勢系のニュースは実行策に落とすまでに追加情報が必要で、企業別の影響度や対象業界を確認する必要がある。【今後】具体的な制度設計、参加企業、投資額、導入時期、関連企業の発表が出るかを追う。","4"
"2026-07-09","20260709-work-2c1ba0fa","work","AI・テック","PR TIMES","2026-07-09","2026-07-09","東京都港区","Nehan株式会社","公共営業AIワークフロー「Labid」、自社の事業内容に合致した案件をレコメンドするAI技術で特許を取得","Nehan株式会社は公共営業AIワークフロー「Labid」の案件レコメンド技術で特許取得。AIが企業実績を分析し、参加可能な適切な入札案件を推薦。提案書作成支援機能も開発中。","https://prtimes.jp/main/html/rd/p/000000026.000120593.html","https://prcdn.freetls.fastly.net/release_image/120593/26/120593-26-9928e0a934ee10593249a6bf2fcc26b8-2400x1260.png?format=jpeg&auto=webp&fit=bounds&width=2400&height=1260","公共営業AIワークフロー「Labid」の稼働イメージ","企業の入札案件探しにおける非効率をAIが解消する技術で特許を取得し、入札提案書作成支援機能も開発中。","入札担当者が目視と経験で案件を判断しており、従来のキーワード主体のサービスでは自社に合致しない案件も多数通知され非効率に陥っていた。AIの活用で適正な案件抽出と入札効率化が求められている。","【要約】AI特許を活用し入札案件の見逃し防止や効率化を実現。 【論点】AIの案件レコメンド精度改善、提案書作成支援の実用化。 【次に見る】実証事例の成果や提案書支援機能の展開状況。","【活用例】公共調達支援サービスや入札コンサルでの提案資料作成に活用。 【メリット】入札業務効率と受注率の向上が期待できる。 【注意点】まだ導入初期で実績蓄積が必要。 【今後】提案書作成支援機能の権利化・製品実装状況に注目。","5"
"2026-07-09","20260709-work-6c0b0ae6","work","AI・テック","PR TIMES","2026-07-09","2026-07-09","香川県高松市","西村ジョイ株式会社、Re Data Science株式会社、株式会社総合オリコミ社","西村ジョイ、生成AI駆動の購買履歴・チラシ情報活用による1to1販促の実証実験を開始","西村ジョイとRe Data Science、総合オリコミ社が生成AIを活用した個別最適化1to1販促の実証実験を開始。購買履歴とチラシ情報を分析し顧客エンゲージメントの強化を狙う。","https://prtimes.jp/main/html/rd/p/000000001.000185348.html","https://prcdn.freetls.fastly.net/release_image/185348/1/185348-1-1f40e8f24ec488599c793959358fe882-3900x1636.png?format=jpeg&auto=webp&fit=bounds&width=2400&height=1260","生成AIを活用した販促戦略イメージ","ホームセンター事業の西村ジョイとデータ解析企業が、生成AIによる顧客単位の販促最適化を目指し実証実験を始めた。","少子高齢化や市場縮小の中、小売業界ではLTV向上のため顧客の興味に合う情報提供が重要となっている。紙チラシも有効だがより高度な個別対応が求められている。","【要約】生成AIを使い購買履歴とチラシ情報で個別販促を実証。 【論点】1to1販促の効果や顧客エンゲージメント向上の具体的効果。 【次に見る】実証実験の成果報告や他小売業界への展開。","【活用例】小売店や販促コンサル提案資料の顧客ターゲティング戦略に活用。 【メリット】顧客ごとにパーソナライズされた販促でLTV向上可能。 【注意点】実証段階で効果検証や実施コストを慎重に評価すべき。 【今後】実証結果と拡張性、顧客体験の変化に注目。","4"
"2026-07-09","20260709-work-1d935a51","work","印刷・製造業","PR TIMES","2026-07-09","2026-07-09","大阪府岸和田市","株式会社ドットログ","建設業向けオーダーメイドAI開発「ケンセツAIラボ」提供開始。図面や受発注業務の自動化支援","株式会社ドットログが建設・設備業界向けオーダーメイドAI開発サービス「ケンセツAIラボ」を開始。図面拾い出しや受発注データ転記など属人化した業務の自動化を短期間デモ開発とセットで提案。","https://prtimes.jp/main/html/rd/p/000000004.000144572.html","https://prcdn.freetls.fastly.net/release_image/144572/4/144572-4-9c5a0199ba25b68c67c77de96e0dc450-1672x941.png?format=jpeg&auto=webp&fit=bounds&width=2400&height=1260","ケンセツAIラボのサービスイメージ","建設業務の手作業・属人化課題に対応するため、各社の実データに合わせたAIシステムの個別開発を開始。無料デモ開発も提供。","建設業界は高齢化と人手不足の中、特有の業務データ多様性により既製ツールが定着しにくく、AIによる業務自動化支援ニーズが高まっている。","【要約】建設業特有業務を個別AI開発で自動化支援。 【論点】受注転記や図面解析の自動化効果と現場適合性。 【次に見る】短期間デモ開発事例の顧客反応と業務効率化成果。","【活用例】建設関連業務DX提案資料やソリューション設計に使う。 【メリット】業界特有の属人業務に対応したAIカスタマイズ。 【注意点】開発コスト・期間と導入後の運用定着を考慮。 【今後】顧客業務に最適化したAI効果測定と拡大展開を注視。","5"
"2026-07-09","20260709-work-efd73a41","work","印刷・製造業","PR TIMES","2026-07-09","2026-07-09","福岡県北九州市","株式会社TEAM FAB","北九州発の製造業DX新会社「TEAM FAB」を設立","TEAM FABは西日本FHグループのイジゲングループと戸畑ターレット工作所の共同出資により設立。製造業向け現場改善とデジタル技術を融合し、地域中小製造業の生産性向上と技能継承を支援。","https://prtimes.jp/main/html/rd/p/000000003.000186609.html","https://prcdn.freetls.fastly.net/release_image/186609/3/186609-3-ebaeb4ae68512e41b922ab6e59f74047-1800x1140.jpg?format=jpeg&auto=webp&fit=bounds&width=2400&height=1260","TEAM FABによる製造業DX推進イメージ","製造業の人手不足や技能離職課題をICTと現場改善で解決するために新会社を設立。地域製造業のDX支援サービス「カイゼン丸」を核に展開。","日本製造業は高い技術力ながらDX推進に入り口課題多く、中小企業のICT活用や技能継承が急務。地域連携による現場改善DX支援モデルが求められている。","【要約】地域製造業の課題を現場改善とDX融合で攻める新会社設立。 【論点】中小製造業のDX入り口支援と技能継承支援の両輪。 【次に見る】初期顧客導入状況と成果、他地域展開の動き。","【活用例】製造業向けDX提案、地域支援モデル紹介資料に活用。 【メリット】中小製造業の現場ニーズに即したリアルなDX支援。 【注意点】地域限定モデルのため展開性やスケール課題を把握。 【今後】他地域連携・成功事例増加とプラットフォーム化注視。","4"
"2026-07-09","20260709-work-f623bfeb","work","AI・テック","PR TIMES","2026-07-09","2026-07-09","東京都","bajji株式会社","キャッシュアウトなし、中堅・中小企業を“AIネイティブ企業”へ変革する伴走型サービス「ポンとAI化」をリリース","bajji株式会社は中堅・中小企業へAI戦略策定から実装、業務改革まで伴走する「ポンとAI化」を提供開始。投資キャッシュアウトなしにAI変革を推進し、代表がCAIOとして深く経営参画し成果創出を目指す。","https://prtimes.jp/main/html/rd/p/000000120.000044789.html","https://prcdn.freetls.fastly.net/release_image/44789/120/44789-120-e33e1383f18f85e62898a39062601fcf-2778x1364.png?format=jpeg&auto=webp&fit=bounds&width=2400&height=1260","伴走型AI変革サービス「ポンとAI化」のイメージ","企業の初期費用負担を軽減しつつAI変革を推進するため、bajji社が少数株主として出資参画し経営参画、全社のAI化体制づくりを支援。","DXやAI活用道半ばの中小企業が多い中、AI導入はツール導入だけでなく経営や組織、業務フロー全体の変革が必要。実行主体の伴走支援がニーズに合致。","【要約】資金負担を抑えつつ経営直結型AI変革を伴走で支援開始。 【論点】実行力あるCAIO参画型のAI変革モデルの市場適合と成果。 【次に見る】トライアル企業の変革進捗と事業価値の実績。","【活用例】中堅中小企業向けAI導入・戦略策定提案に活用。 【メリット】初期負担軽減と経営参画で実効性を高める。 【注意点】投資回収や成果創出までの長期伴走性に留意。 【今後】適用広がりによる成果事例集積と業務フロー最適化事例注視。","5"
"2026-07-09","20260709-society-0d41f6c7","society","AI・テック","NHK 経済ニュース","2026-07-07","2026-07-07","日本全国","メガバンク3行","メガバンク、中小企業向けAI活用金融サービスの強化相次ぐ","メガバンク3行が中小企業を対象に、AIを活用した決済などの金融サービス強化を進めている。金利上昇局面で顧客獲得競争が激化する中、中小企業との取引増加を狙う。","https://news.web.nhk/newsweb/na/na-k10015170411000","https://imgu.web.nhk/news/u/news/html/20260707/K10015170411_2607070007_0707054437_01_02.jpg","メガバンクの金融サービス強化イメージ","中小企業に対するAI技術を活用した決済サービスなどの提供体制を強化している。","金利が上昇し資金調達が難しくなる環境下で、メガバンクは中小企業の経営支援を拡大し取引基盤の強化を図っている。金融業界全体でDX推進が加速。","【要約】メガバンクがAI活用による中小企業向け金融サービス拡充。 【論点】AIによる信用判断や決済利便性向上への効果。 【次に見る】取引件数やAIサービス利用率の推移焦点。","【意味】【意味】中小企業支援の金融DX推進意味。 【影響】中小企業の資金調達や経営効率化に寄与。 【リスク】AI信用判断の誤判定や過剰貸し出し懸念。 【今後】AI金融サービスの精度向上と普及動向に注目。【影響】提案冒頭で「なぜ今この論点が重要か」を説明し、対象業界の優先課題を整理しやすくなる。【リスク】政策・国際情勢系のニュースは実行策に落とすまでに追加情報が必要で、企業別の影響度や対象業界を確認する必要がある。【今後】具体的な制度設計、参加企業、投資額、導入時期、関連企業の発表が出るかを追う。","4"
"2026-07-09","20260709-society-4717f9cd","society","AI・テック","NHK 政治ニュース","2026-07-08","2026-07-08","参議院特別委員会","日本国会","個人情報保護法改正案が参議院特別委で可決、AI開発促進に向け規制緩和","AI開発促進を目指し、個人情報取得規制の緩和や個人権利侵害に対する課徴金導入を盛り込んだ個人情報保護法の改正案が参議院特別委で可決された。","https://news.web.nhk/newsweb/na/na-k10015171871000","https://imgu.web.nhk/news/u/news/html/20260708/K10015171871_2607081558_0708163629_01_02.jpg","法改正に向けた参議院特別委員会の様子","参議院特別委で個人情報保護法改正案が賛成多数で可決。AI開発環境整備を目的とした規制緩和などを盛り込む。","AI技術の急速な活用拡大に対応し、実証実験やサービス展開を促すため現行の個人情報取得や利用に関わる規制緩和が求められていた。","【要約】AI開発推進のための個人情報保護法改正が可決。 【論点】個人情報保護とAI開発促進のバランス調整課題。 【次に見る】法施行後の運用実態や企業対応を注視。","【意味】【意味】AI実証実験や開発加速への法整備。 【影響】国内AI産業投資やイノベーション環境向上。 【リスク】個人権利侵害問題や情報漏洩リスク増加。 【今後】ガイドライン整備と企業側のコンプライアンス対応がカギ。【影響】提案冒頭で「なぜ今この論点が重要か」を説明し、対象業界の優先課題を整理しやすくなる。【リスク】政策・国際情勢系のニュースは実行策に落とすまでに追加情報が必要で、企業別の影響度や対象業界を確認する必要がある。【今後】具体的な制度設計、参加企業、投資額、導入時期、関連企業の発表が出るかを追う。","5"
