date,id,section,category,source_name,published_date,event_date,location,actor,title,summary,source_url,source_image_url,image_caption,what_happened,background,watch_point,work_hint,importance
"2026-07-02","20260702-01","work","印刷・製造業","PR TIMES","2026-07-02","2026-07-02","日本国内","株式会社JASP","JASP、循環型経済の実現に向けリサイクル工場と業務提携を開始","株式会社JASPは国内の再生プラスチック企業と連携し、高品質な再生プラスチック材料の販売・供給拡大で持続可能な資源循環社会構築に貢献します。","https://prtimes.jp/main/html/rd/p/000000012.000182734.html","https://prcdn.freetls.fastly.net/release_image/182734/12/182734-12-4d965fa436bba3cd60ddfc39807eac83-1841x1101.png?format=jpeg&auto=webp&fit=bounds&width=2400&height=1260","","JASPは使用済み家電やOA機器から回収したプラスチックを高純度・安定品質に再加工したリサイクル素材を提供し、原料から出荷まで品質管理と認証を徹底しています。","プラスチック廃棄物削減とカーボンニュートラル実現が製造業の重要課題であり、循環型経済促進に資するため高品質な再生プラスチック材料へのニーズが高まっています。","今後さらに再生素材の活用範囲が拡大し、環境負荷低減と製品開発が進む動向に注目です。","環境配慮型製造の提案や顧客向け環境価値訴求の資料作成に活用可能です。","4"
"2026-07-02","20260702-02","work","AI・テック","PR TIMES","2026-07-02","2026-07-02","東京都文京区","株式会社Mavericks","動画生成AI「NoLang」に北欧3言語追加 翻訳不要で北欧市場向け動画内製化を実現","株式会社Mavericksは動画生成AI「NoLang」にスウェーデン語・デンマーク語・フィンランド語を追加し、北欧向け動画制作を効率化しました。","https://prtimes.jp/main/html/rd/p/000000146.000129953.html","https://prcdn.freetls.fastly.net/release_image/129953/146/129953-146-5dafba8272652eddc11ba10ed4435034-1920x1080.png?format=jpeg&auto=webp&fit=bounds&width=2400&height=1260","","利用者は言語を選択するだけで日本語資料から現地語のナレーション付き動画を自動生成でき、翻訳会社やナレーターを介さずにコンテンツを内製化できます。","北欧は高いデジタル普及率を誇り、多言語コンテンツの重要性が増していますが、日本語・英語のみの発信では浸透に限界があります。","多言語対応の自動化によりグローバル発信力強化やコスト削減が期待され、他言語追加の動きも注目されます。","多言語動画制作や海外マーケティング提案などに役立つ新技術の一例として活用できます。","5"
"2026-07-02","20260702-03","work","AI・テック","PR TIMES","2026-07-02","2026-07-02","オンライン","LINEヤフー株式会社","LINEのトークルームでAIエージェント「Agent i」が質問・タスク支援する新機能提供予定","LINEヤフーがトークルーム内でAIエージェント「Agent i」を呼び出し、文脈理解による質問回答やタスク管理を支援する新機能を2026年内に提供します。","https://prtimes.jp/main/html/rd/p/000001754.000129774.html","https://prcdn.freetls.fastly.net/release_image/129774/1754/129774-1754-8e4cfddc58e9001c5ce7c37c692d1a1a-2400x1350.png?format=jpeg&auto=webp&fit=bounds&width=2400&height=1260","","利用者はトークルーム内でAgent iと自然な会話を行い、回答を共有しながら全員で確認や会話の広がりを実現。要約や費用割り勘、カレンダー登録支援など多彩な機能追加も計画中。","従来のチャット支援を超え、会話の文脈把握による業務・日常生活の効率化支援ニーズが高まっています。","今後の進化でコミュニケーションアプリ内のAI活用が拡大し、業務効率化・情報共有の新たな形を示します。","顧客対応や社内チャット連携に向けたAIアシスタント活用の参考になります。","5"
"2026-07-02","20260702-04","work","AI・テック","PR TIMES","2026-07-02","2026-07-23","オンライン","ギークス株式会社","ITエンジニア向け無料セミナー 「フルサイクルエンジニアが前提条件になる時代 ～AI時代のキャリア戦略～」開催","ギークスがAI時代に求められる企画から運用まで関わるフルサイクルエンジニアの重要性を解説するオンライン無料セミナーを7月23日に開催します。","https://prtimes.jp/main/html/rd/p/000000353.000000486.html","https://prcdn.freetls.fastly.net/release_image/486/353/486-353-77ff80d5d152b36cda44a586856d025c-1920x1080.png?format=jpeg&auto=webp&fit=bounds&width=2400&height=1260","","BASE株式会社の開発マネージャー斉藤氏が登壇し、Claude Code活用による少人数高速開発プロセスの実例も交えつつ、今後のエンジニアキャリア戦略を紹介します。","AI導入による開発自動化が進む中、単なるコーディングから脱却し全体最適の視点を持つエンジニアの育成が急務となっています。","技術力のみならず越境的な視点とオーナーシップを持つ人材が今後の組織を牽引する鍵となります。","開発組織の育成方針や人材評価基準の検討に役立つ情報を得られます。","4"
"2026-07-02","20260702-05","work","デザイン・UX","PR TIMES","2026-07-02","2026-07-27","オンラインウェビナー","株式会社ヴィス","日本オフィス学会主催 第65回JOS研究セミナーに登壇 オフィスデザインの今と未来を議論","株式会社ヴィスの小川執行役員が7月27日開催のJOS研究セミナーに登壇し、最新オフィスデザインコンセプトの現状と展望を解説・議論します。","https://prtimes.jp/main/html/rd/p/000000287.000058162.html","https://prcdn.freetls.fastly.net/release_image/58162/287/58162-287-38bf9d2018fb9c20ac8bf49b3a31e552-3900x2600.jpg?format=jpeg&auto=webp&fit=bounds&width=2400&height=1260","","第1部で現在のオフィス環境のコンセプト立案を紹介し、第2部のパネルディスカッションでは産学連携の視点から未来のオフィスデザインの方向性を探ります。","オフィスは企業文化や生産性を左右する経営資産として注目され、デザインコンセプトの進化が求められています。","経営層との対話を深め、本質的課題解決を目指すデザイン戦略の実践例として参考になります。","企画提案資料やプレゼンの内容強化に最新トレンドを反映させる際に活用可能です。","4"
"2026-07-02","20260702-06","society","国内情勢","NHK 政治ニュース","2026-07-02","2026-07-02","日本政府","政府","政府、海外からの直接投資呼び込む政策パッケージを決定","政府は海外ベンチャーキャピタルによる国内スタートアップの共同出資規制緩和などを盛り込んだ新たな直接投資呼び込み策を決定しました。","https://news.web.nhk/newsweb/na/na-k10015167191000","https://imgu.web.nhk/news/u/news/html/20260702/K10015167191_2607021503_0702160440_01_02.jpg","","政府は海外の投資を促進するため、規制を見直し海外資本が日本の革新的企業へ積極的に投資できる環境整備を進める政策パッケージを公表しました。","グローバル経済競争の激化に対応し、国内産業の活性化や技術革新促進のため海外資本誘致を強化する必要があります。","今後の具体的施策と規制緩和の効果を注視し、スタートアップ環境の変化を捉えることが重要です。","海外ビジネス展開や投資環境に対する理解促進、経営戦略検討に役立ちます。","5"
"2026-07-02","20260702-07","society","国内情勢","NHK 経済ニュース","2026-07-01","2026-07-01","日本","日本銀行","日銀短観で大企業製造業の景況感改善を確認 ものづくりの現場動向も注目","2026年7月1日発表の日銀短観で、大企業製造業の景況感指数が5期連続改善し、新規設備投資も進む一方、輸入遅延や価格高止まりへの懸念も残ります。","https://news.web.nhk/newsweb/na/na-k10015165321000","https://imgu.web.nhk/news/u/news/html/20260701/K10015165321_2607011542_0701192130_01_03.jpg","","日銀短観調査により、製造業の景況感が向上し好調を示した一方で、中東情勢の影響による石油製品輸入遅延やコスト増加の懸念が業界内に根強くあることも明らかとなりました。","世界経済環境や地政学的リスクがものづくり産業に影響する中、設備投資動向は今後の業績見通しに重要な要素となっています。","サプライチェーンの安定化やコスト管理策の進展、国内外の中長期的市場動向を注視する必要があります。","生産計画や調達戦略の見直し、新技術・設備投資の意思決定に活用可能です。","5"
"2026-07-03","20260703-work-4249e750","work","印刷・製造業","PR TIMES","2026-07-03","2026-07-03","東京都豊島区東池袋三","株式会社サムライソード","夏のご挨拶、今年はスマホで手軽に。コンビニで印刷できる『マイメッセージカード』に暑中見舞い向けデザインを公開","スマホで簡単にデザインを選びメッセージを入力、全国のコンビニで印刷可能な暑中見舞いカードの新デザインを公開。外出先でも手軽に季節の挨拶が可能です。","https://prtimes.jp/main/html/rd/p/000000300.000027316.html","https://prcdn.freetls.fastly.net/release_image/27316/300/27316-300-b97265a039eef874e884843f1be1b139-1920x1920.png?format=jpeg&auto=webp&fit=bounds&width=2400&height=1260","コンビニプリントサービス『マイメッセージカード』の暑中見舞いデザイン例","株式会社サムライソードは、スマホから選んだデザインでメッセージを作成し、全国のコンビニで印刷できる『マイメッセージカード』に暑中見舞い向けの新デザインを追加しました。","暑中見舞いは季節の挨拶として広く親しまれていますが、はがき購入や手書きの手間がネックでした。スマホとコンビニプリントを活用し、気軽に対応できるサービスとして注目されています。","今後、季節やイベントに合わせたカスタマイズ印刷の需要拡大が予想され、店舗イベントでの利用提案も期待されます。","小ロットや急ぎ需要に応えられるサービスの導入は、顧客接点の拡大や業務効率化に資すると考えられます。","4"
"2026-07-03","20260703-work-dcadcb69","work","AI・テック","PR TIMES","2026-07-03","2026-07-03","東京都渋谷区","株式会社Leadsia","電話を「受ける・かける・追う」3つの音声AIエージェントを提供開始 ― 申込当日に市外局番、最短3分で稼働","中小企業向けに電話業務を自動化する音声AIエージェント3種を開始。手軽に導入可能で、受付・営業・追客を効率化し、電話業務負担を大幅軽減します。","https://prtimes.jp/main/html/rd/p/000000001.000186220.html","https://prcdn.freetls.fastly.net/release_image/186220/1/186220-1-5003780201555bbbce9084463b5d3ea7-2400x1260.png?format=jpeg&auto=webp&fit=bounds&width=2400&height=1260","Leadsiaの音声AIエージェントイメージ","株式会社Leadsiaは、電話の受付、発信、追客を担う音声AIエージェント「SOPHIA」「ALICE」「LYDIA」を開発・提供開始しました。市外局番番号が即日発行され、最短3分で稼働可能です。","中小企業では電話対応が人手不足や時間確保の課題となっており、AIを活用した自動化技術の需要が増加しています。導入の容易さと即時稼働が特徴です。","AI電話応対の普及は顧客接点の24時間化や営業効率向上に寄与し、業界全体のDX推進の鍵となります。","電話関連の業務自動化を進めることで、人的リソースを戦略的業務へ集中できる体制構築が可能です。","5"
"2026-07-03","20260703-work-a217f787","work","デザイン・UX","PR TIMES","2026-07-03","2026-07-03","東京都港区","株式会社モンドデザイン","一瞬でカードサイズに収納できる新構造のエコバッグ「THE CARD BAG」7月3日より予約販売開始","カードサイズに折りたためるコンパクトかつ大容量のエコバッグが発売。日常携帯の利便性と実用性を両立した新デザインがSNSで話題です。","https://prtimes.jp/main/html/rd/p/000000082.000026462.html","https://prcdn.freetls.fastly.net/release_image/26462/82/26462-82-8ca25c2745640c4e36c08cfdff13b9d5-1920x1280.jpg?format=jpeg&auto=webp&fit=bounds&width=2400&height=1260","THE CARD BAGの折り畳みイメージ","株式会社モンドデザインは、約1.2kgの薄型軽量で、3ステップでカードサイズに折り畳めるエコバッグ『THE CARD BAG』の予約販売を開始しました。胸ポケットなどに収まる携帯性と2リットル4本分の容量が特徴です。","エコバッグ利用者の持ち運び忘れ防止に着目し、携帯性に優れ、スムーズに折り畳める新構造を追求。素材の選定や縫製も繰り返し改良しました。","携帯性とデザイン性の両立により、日常使いのエコバッグ市場での差別化とユーザー満足度向上が期待されます。","デザインとUX面を強化し、店舗イベントや販促品としての応用も可能です。","4"
"2026-07-03","20260703-work-585be0cc","work","印刷・製造業","PR TIMES","2026-07-03","2026-07-03","大阪府箕面市","おたふく手袋株式会社","創業100年のおたふく手袋、機能性ウェアで進化。ペルチェ市場参入で新成長軸","創業100周年を迎えたおたふく手袋は、作業用手袋から機能性インナーやワークシューズまで多角的に展開。ペルチェ式ウェア市場参入で暑熱対策製品を強化しています。","https://prtimes.jp/main/html/rd/p/000000048.000091944.html","https://prcdn.freetls.fastly.net/release_image/91944/48/91944-48-2cb0d8774f9f5e140f47a1d0855048c0-640x480.jpg?format=jpeg&auto=webp&fit=bounds&width=2400&height=1260","おたふく手袋の機能性インナーウェア","おたふく手袋は、2026年に創業100年を迎え、機能性ブランドを拡充するとともに、2025年からペルチェ式冷却ウェア市場に参入し、新たな成長戦略を推進しています。","同社は1926年に手袋製造から始まり、時代のニーズに対応しつつ製品領域拡大を継続。市場ニーズである暑熱対策や快適性にフォーカスした商品開発を進めています。","高機能素材や冷却技術の採用が今後のワークウェア業界の競争優位に資する可能性があり、今後の製品展開に注目です。","製造業の現場ニーズを反映した製品企画は、販路開拓やブランド価値向上に寄与します。","4"
"2026-07-03","20260703-work-7aec27c9","work","AI・テック","PR TIMES","2026-07-03","2026-07-03","東京都豊島区","株式会社AI Orchestra","AIの学校AI Crew、経営者・個人事業主・士業のためのAIエージェント実装メディアを開設 ─ 代表自らClaude Code・Codexで運営し、開設1ヶ月で記事29本を公開","プログラミング未経験者向けにAIエージェント活用法を実践的に解説するメディアを開設。経営者などの実例をもとに業務へのAI導入ノウハウを共有しています。","https://prtimes.jp/main/html/rd/p/000000022.000060548.html","https://prcdn.freetls.fastly.net/release_image/60548/22/60548-22-3e525746cda35d7037d4ebc0ffd8e457-1536x1024.png?format=jpeg&auto=webp&fit=bounds&width=2400&height=1260","AIの学校AI CrewのWEBサイトイメージ","株式会社AI Orchestraが運営するAIの学校AI Crewは、代表自ら実践しながら経営者や士業向けにAIエージェントの実装事例や操作方法を解説するメディアを公式サイト内に開設し、1ヶ月で29本の記事を公開しました。","生成AIの関心が高まる一方で、非エンジニアの利用者の技術習得には障壁があり、情報不足による挫折も多い状況です。実務者視点の具体的事例を提供することが目的です。","AI導入の実践的事例共有は、利用拡大と効果的活用促進に重要であり、他業種でも参照価値が高まると予想されます。","同様のメディアや教育プログラムを企画・実施する際のモデルとして活用でき、社内研修にも応用可能です。","4"
"2026-07-03","20260703-society-07685c55","society","国内情勢","NHK 主要ニュース","2026-07-03","2026-07-03","債券市場","不特定多数の投資家","長期金利 約29年ぶり一時2.81％に上昇 インフレ加速観測などで","7月3日の債券市場で長期金利が29年ぶりの高水準2.81％まで上昇。日銀の利上げ遅れやインフレ加速観測が背景で、国債売却が活発化しています。","https://news.web.nhk/newsweb/na/na-k10015167801000","https://imgu.web.nhk/news/u/news/html/20260703/K10015167801_2607030934_0703094705_01_02.jpg","債券市場の動きを示すチャート（イメージ）","3日、債券市場で長期金利が一時2.81％に上昇し、約29年ぶりの高さを記録しました。インフレ加速予想や日銀の利上げ鈍化見込みが国債の売り圧力を高めています。","長期金利は経済状況や金融政策期待の影響を受けやすく、今回の上昇は市場の金利上昇見通しの変化を反映しています。インフレ加速は物価上昇の持続性を示唆します。","今後の日銀の政策方針やインフレ動向は長期金利にさらに影響し、企業の資金調達コストや住宅ローン金利にも波及するため注視が必要です。","金融情勢の変化は国内経済や事業の資金調達環境に影響するため、企画や資金管理に反映してください。","4"
"2026-07-03","20260703-society-868da63c","society","国内情勢","NHK 政治ニュース","2026-07-03","2026-07-03","日本、インド","高市総理大臣、モディ首相、日本企業","日印首脳会談で2兆円規模の投資発表 国内経済活性化の狙い","7月2日、日印首脳会談で日本企業による約2兆円規模のインド投資が発表され、約130件の企業間協力文書も公開。国内経済の活性化を目指します。","https://news.web.nhk/newsweb/na/na-k10015167611000","https://imgu.web.nhk/news/u/news/html/20260703/K10015167611_2607030059_0703055001_01_02.jpg","日印首脳会談の様子（イメージ）","高市総理大臣はモディ首相と会談し、日本企業による2兆円規模のインド投資を含む企業協力文書130件を発表しました。インド市場への投資促進を通じ国内経済の活性化を図ります。","巨大市場のインドは日本企業にとって重要な成長拠点であり、政府間の連携強化が企業活動促進と経済成長に寄与すると期待されています。","両国の経済連携強化は今後の貿易・投資動向に影響を与え、関連企業の海外展開戦略に注目が集まります。","インド市場を念頭に置いた企画や製品開発、投資戦略を検討すると効果的です。","4"
"2026-07-06","20260706-work-eab15b6b","work","デザイン・UX","PR TIMES","2026-07-06","2026-07-06","東京都","アドビ株式会社","企業向けにクリエイティブワークフローを自動化する「Adobe Firefly Graph」と「Workflow Builder」を提供開始","アドビが企業向けにクリエイティブ制作の自動化を可能にする生成AIツールを導入し、効率的で一貫性のあるコンテンツ作成を支援します。","https://prtimes.jp/main/html/rd/p/000000554.000041087.html","https://prcdn.freetls.fastly.net/release_image/41087/554/41087-554-88159fe888e6bcef63033926c9d7ecfc-2000x1000.jpg?format=jpeg&auto=webp&fit=bounds&width=2400&height=1260","","2026年7月6日、アドビ株式会社は企業向けにクリエイティブワークフローを自動化する「Adobe Firefly Graph」と「Workflow Builder」を発表しました。","急増するコンテンツ需要に対応するため、制作の効率化が求められており、多くの企業が生成AIを導入しつつも全社展開には課題を抱えています。","制作プロセス全体の自動化とノウハウ共有が可能となるため、企業のクリエイティブ制作最適化に期待が寄せられています。","デザインや資料作成業務でのAI活用を検討している企業の担当者は注目すべき新ツール。","5"
"2026-07-06","20260706-work-ec367e28","work","ゲーミフィケーション","PR TIMES","2026-07-06","2026-07-06","大阪市","ラトックシステム株式会社","AmazonプライムデーでHDMI切替器などゲーム/PC周辺機器60点以上が特別価格に","ラトックシステムがAmazonプライムデーで人気のゲーム・PC周辺機器を最大30%オフで提供。ゲーミフィケーション活用や業務効率に活用可能。","https://prtimes.jp/main/html/rd/p/000000376.000023921.html","https://prcdn.freetls.fastly.net/release_image/23921/376/23921-376-a5fae9ab1f8490c0d3c874be8f37a7c1-1000x500.jpg?format=jpeg&auto=webp&fit=bounds&width=2400&height=1260","","2026年7月7日から13日までの期間、同社はHDMI切替器を含む60以上のゲーム/PC周辺機器を割引価格で販売します。","複数機器の切替を簡単にする製品で、ゲームの快適なプレイやマルチ操作を実現し、ゲーミフィケーション等に有用です。","高リフレッシュレート対応やノイズキャンセリング機能搭載モデルもあり、実際の使用シーンやニーズに合わせた選択が可能。","ゲーミフィケーション企画や社内外イベントの技術導入検討時に視野に入れると良い製品群。","4"
"2026-07-06","20260706-work-0a09eb52","work","印刷・製造業","PR TIMES","2026-07-06","2026-07-06","埼玉県富士見市","EDIFIER JAPAN","Amazonプライムデーで人気オーディオ製品を最大約50％OFF販売","EDIFIER JAPANがプライムデーでワイヤレスイヤホンやヘッドホンなど高性能オーディオ製品を最大50％オフで販売し、音響業務の効率化に貢献。","https://prtimes.jp/main/html/rd/p/000000064.000083226.html","https://prcdn.freetls.fastly.net/release_image/83226/64/83226-64-719c712d67dd1b458387d3e3229406f6-1920x1080.png?format=jpeg&auto=webp&fit=bounds&width=2400&height=1260","","2026年7月7日から13日まで、同社は音楽制作やリスニングに使える幅広いオーディオ製品を割引販売します。","音楽制作や資料作成に不可欠な高音質環境づくりのニーズが増加しており、コスト削減と性能向上を両立。","DTMやデジタルコンテンツ制作現場での導入事例が期待され、作業効率向上に寄与します。","企画・提案資料作成やプレゼン環境のアップグレード検討に活用可能。","4"
"2026-07-06","20260706-work-59409bf4","work","印刷・製造業","PR TIMES","2026-07-06","2026-07-06","東京都千代田区","株式会社No.1","中小企業の採用活動に特化した人手不足対策サービス「採用アシスタント」を拡充、3新サービス提供開始","株式会社No.1が中小企業の採用活動を支援する「採用アシスタント」を強化し、SNS就活対応や採用サイト構築、受電代行サービスを開始。","https://prtimes.jp/main/html/rd/p/000000101.000055597.html","https://prcdn.freetls.fastly.net/release_image/55597/101/55597-101-a60cc00c06825e90a4a7a834005d256f-1763x979.png?format=jpeg&auto=webp&fit=bounds&width=2400&height=1260","","2026年7月6日、同社は主力の採用支援サービスを進化させ、Instagram運用代行やWix活用の採用サイト制作、応募者対応のための電話代行を新たに提供開始しました。","人手不足倒産が増加する中、小規模企業の採用活動効率化が急務で、迅速かつ丁寧な応募者対応の重要性が増しています。","SNS活用やデジタルツール導入で若者採用の質を高め、応募辞退防止に役立つサービスとして期待されます。","印刷業や店舗イベント企画における人材確保や社内外広報活動の効率化に注目。","5"
